{
  "v": 2,
  "meta": {
    "name": "Hero square",
    "author": "Pixelstage",
    "note": "One avatar, ink outline, poster title. Renders a 1080×1080 PNG."
  },
  "cast": [
    {
      "id": "hero",
      "name": "Steve",
      "skin": "steve",
      "model": "default",
      "pose": "hero",
      "motion": { "preset": "wave", "speed": 1 },
      "position": { "x": 0, "y": 0, "z": 0 },
      "scale": 1,
      "outer": true,
      "nametag": ""
    }
  ],
  "camera": { "preset": "full" },
  "stage": {
    "pack": "hero-studio",
    "grade": "clean",
    "outline": "ink",
    "light": "soft",
    "keyIntensity": 1.15,
    "godrays": false
  },
  "text": {
    "title": "Steve, rebuilt",
    "subtitle": "Skin stage demo",
    "kicker": "PIXELSTAGE",
    "template": "mod-promo",
    "scale": 1
  },
  "export": {
    "format": "square",
    "motion": { "fps": 15, "gifEdge": 720, "mp4Edge": 1080, "mp4Fps": 30, "frames": 0 }
  }
}
